diseases,medicine_1,medicine_2,medicine_3,side_effects
Labyrinthitis,Prednisone, Meclizine, Diazepam,"Dizziness, Vertigo, Hearing loss, Nausea, Vomiting, Ear pain"
Anxiety,Sertraline, Escitalopram, Alprazolam,"Excessive worry, Restlessness, Rapid heartbeat, Sweating, Trembling, Difficulty concentrating"
Impulse Control Disorder,Lithium, Carbamazepine, Fluoxetine,"Inability to resist urges, Tension before acting, Relief after acting, Aggression, Mood swings"
Stenosis of the Tear Duct,No drug; surgical procedure (DCR),,,"Excessive tearing, Eye discharge, Blurred vision, Swelling near inner eye corner, Recurrent eye infections"
Abscess of Nose,Clindamycin, Amoxicillin-Clavulanate, Trimethoprim-Sulfamethoxazole,"Nasal pain, Swelling, Redness, Fever, Nasal discharge, Tenderness"
Omphalitis,Ampicillin, Gentamicin, Cloxacillin,"Redness around navel, Swelling, Discharge, Foul odor, Fever, Warmth"
Leukemia,Imatinib, Cytarabine, Daunorubicin,"Fatigue, Frequent infections, Easy bruising, Bleeding, Bone pain, Swollen lymph nodes"
Bell Palsy,Prednisone, Acyclovir, Valacyclovir,"Facial drooping, Difficulty closing eye, Drooling, Loss of taste, Facial pain, Headache"
Conjunctivitis due to Allergy,Olopatadine, Ketotifen, Azelastine,"Red eyes, Itching, Watery discharge, Swollen eyelids, Burning sensation"
Drug Reaction,Diphenhydramine, Methylprednisolone, Epinephrine,"Skin rash, Itching, Fever, Swelling, Difficulty breathing, Nausea"
Adrenal Cancer,Mitotane, Cisplatin, Etoposide,"Abdominal pain, Weight loss, Fatigue, Hormonal changes, Back pain, Fever"
Myopia,No drug; corrective lenses or surgery,,,"Blurred distant vision, Squinting, Headaches, Eye strain, Difficulty seeing at night"
Osteoarthritis,Ibuprofen, Naproxen, Diclofenac,"Joint pain, Stiffness, Swelling, Reduced range of motion, Bone spurs, Tenderness"
Thyroid Disease,Levothyroxine, Propylthiouracil, Methimazole,"Fatigue, Weight changes, Temperature sensitivity, Mood changes, Hair loss, Heart palpitations"
Pharyngitis,Penicillin V, Amoxicillin, Azithromycin,"Sore throat, Difficulty swallowing, Fever, Swollen lymph nodes, Hoarseness, Cough"
Chronic Rheumatic Fever,Benzathine Penicillin G, Aspirin, Prednisone,"Joint pain, Fever, Chest pain, Rash, Fatigue, Heart murmur"
Hypocalcemia,Calcium Gluconate, Calcium Carbonate, Calcitriol,"Muscle cramps, Tingling, Numbness, Fatigue, Seizures, Anxiety"
Macular Degeneration,Ranibizumab, Bevacizumab, Aflibercept,"Blurred central vision, Dark spots, Distorted vision, Difficulty reading, Color changes"
Pneumonia,Amoxicillin, Azithromycin, Levofloxacin,"Cough with phlegm, Fever, Chills, Shortness of breath, Chest pain, Fatigue"
Cold Sore,Acyclovir, Valacyclovir, Famciclovir,"Tingling lips, Painful blisters, Burning sensation, Itching, Crusting, Swelling"
Premature Ventricular Contractions (PVCs),Metoprolol, Atenolol, Amiodarone,"Palpitations, Fluttering chest, Skipped heartbeats, Dizziness, Shortness of breath"
Testicular Cancer,Bleomycin, Etoposide, Cisplatin,"Testicular lump, Swelling, Heaviness in scrotum, Back pain, Breast tenderness, Fatigue"
Hydrocephalus,Acetazolamide (temporary); surgical shunt,,,"Enlarged head, Headache, Nausea, Vomiting, Vision problems, Cognitive changes"
Breast Cancer,Tamoxifen, Trastuzumab, Doxorubicin,"Breast lump, Nipple discharge, Skin dimpling, Breast pain, Nipple changes, Swollen lymph nodes"
Anemia due to Malignancy,Epoetin Alfa, Darbepoetin Alfa, Ferrous Sulfate,"Fatigue, Weakness, Pale skin, Shortness of breath, Dizziness, Cold hands"
Esophageal Varices,Propranolol, Nadolol, Octreotide,"Vomiting blood, Black stools, Dizziness, Fainting, Abdominal pain, Shock"
Endometrial Cancer,Medroxyprogesterone, Carboplatin, Paclitaxel,"Abnormal vaginal bleeding, Pelvic pain, Watery discharge, Painful urination, Weight loss"
Cystic Fibrosis,Ivacaftor, Lumacaftor, Tezacaftor,"Chronic cough, Thick mucus, Frequent lung infections, Poor growth, Salty skin, Digestive issues"
Intertrigo (Skin Condition),Clotrimazole, Miconazole, Mupirocin,"Skin rash in folds, Redness, Itching, Raw skin, Burning, Odor"
Parathyroid Adenoma,No drug; surgical parathyroidectomy,,,"Fatigue, Weakness, Bone pain, Kidney stones, Nausea, Depression"
Glucocorticoid Deficiency,Hydrocortisone, Prednisone, Fludrocortisone,"Fatigue, Weakness, Weight loss, Low blood pressure, Nausea, Skin darkening"
Temporomandibular Joint Disorder,Ibuprofen, Naproxen, Diazepam,"Jaw pain, Clicking jaw, Difficulty chewing, Facial pain, Headache, Ear pain"
Wilson Disease,Penicillamine, Trientine, Zinc Sulfate,"Liver disease, Neurological symptoms, Psychiatric symptoms, Kayser-Fleischer rings, Tremors"
Vesicoureteral Reflux,Trimethoprim-Sulfamethoxazole, Nitrofurantoin,,"Frequent UTIs, Fever, Back pain, Painful urination, Foul-smelling urine, Bedwetting"
Vitamin A Deficiency,Retinol (Vitamin A), Beta-Carotene,,"Night blindness, Dry eyes, Skin problems, Frequent infections, Poor growth, Corneal damage"
Gonorrhea,Ceftriaxone, Azithromycin, Doxycycline,"Painful urination, Discharge, Pelvic pain, Testicular pain, Sore throat, Rectal discharge"
Fracture of the Rib,Ibuprofen, Naproxen, Acetaminophen,"Chest pain, Worse with breathing, Tenderness, Swelling, Bruising, Shortness of breath"
Ependymoma,Temozolomide, Carboplatin, Cisplatin,"Headache, Nausea, Vomiting, Neck pain, Back pain, Neurological deficits"
Hepatitis due to a Toxin,N-Acetylcysteine, Silymarin,,"Jaundice, Fatigue, Nausea, Abdominal pain, Dark urine, Loss of appetite"
Vaginal Cyst,No drug; surgical excision if symptomatic,,,"Vaginal lump, Discomfort, Pain during intercourse, Painful urination, Swelling"
Open Wound of the Shoulder,Amoxicillin-Clavulanate, Cephalexin, Tetanus Toxoid,"Pain, Bleeding, Swelling, Limited movement, Bruising, Tissue damage"
Ectopic Pregnancy,Methotrexate,,,"Sharp pelvic pain, Vaginal bleeding, Shoulder pain, Dizziness, Fainting, Nausea"
Chronic Knee Pain,Ibuprofen, Naproxen, Diclofenac,"Persistent knee pain, Stiffness, Swelling, Reduced range of motion, Weakness, Clicking"
Pinguecula,Artificial Tears, Ketorolac, Fluorometholone,"Yellow eye growth, Eye irritation, Dryness, Redness, Foreign body sensation"
Hypergammaglobulinemia,Treat cause; Prednisone, Hydroxychloroquine,,"Fatigue, Frequent infections, Joint pain, Swollen lymph nodes, Weight loss, Fever"
Alcohol Abuse,Naltrexone, Acamprosate, Disulfiram,"Craving alcohol, Loss of control, Physical dependence, Tolerance, Withdrawal symptoms, Neglecting responsibilities"
Carpal Tunnel Syndrome,Triamcinolone, Ibuprofen, Vitamin B6 (Pyridoxine),"Hand numbness, Tingling, Weakness, Night pain, Wrist pain, Dropping objects"
Pituitary Disorder,Cabergoline, Bromocriptine, Octreotide,"Hormonal imbalance, Headaches, Vision problems, Fatigue, Weight changes, Growth abnormalities"
Kidney Stone,Tamsulosin, Potassium Citrate, Hydrochlorothiazide,"Severe back pain, Flank pain, Blood in urine, Nausea, Vomiting, Painful urination"
Autism,Risperidone, Aripiprazole, Sertraline,"Social difficulties, Communication problems, Repetitive behaviors, Sensory sensitivity, Restricted interests"
Cat Scratch Disease,Azithromycin, Doxycycline, Rifampicin,"Swollen lymph nodes, Fever, Fatigue, Headache, Rash, Cat scratch lesion"
Chronic Glaucoma,Latanoprost, Timolol, Brimonidine,"Gradual vision loss, Peripheral vision loss, Blurred vision, Eye pain, Halos around lights"
Retinal Detachment,No drug; surgical repair,,,"Floaters, Flashes of light, Shadow in vision, Blurred vision, Vision loss"
Aplastic Anemia,Cyclosporine, Antithymocyte Globulin, Eltrombopag,"Fatigue, Frequent infections, Easy bruising, Bleeding, Pallor, Shortness of breath"
Overflow Incontinence,Bethanechol, Tamsulosin, Oxybutynin,"Frequent dribbling, Weak urine stream, Frequent urination, Feeling of incomplete emptying"
Hemolytic Anemia,Prednisone, Rituximab, Folic Acid,"Fatigue, Jaundice, Pale skin, Shortness of breath, Dark urine, Rapid heartbeat"
Lateral Epicondylitis (Tennis Elbow),Ibuprofen, Naproxen, Triamcinolone,"Elbow pain, Forearm weakness, Pain with grip, Tenderness, Stiffness, Aching"
Open Wound of the Eye,Moxifloxacin, Tobramycin, Ciprofloxacin eye drops,"Eye pain, Bleeding, Vision changes, Swelling, Tearing, Light sensitivity"
Syphilis,Benzathine Penicillin G, Doxycycline, Ceftriaxone,"Painless sore, Rash, Flu-like symptoms, Swollen lymph nodes, Hair loss, Neurological symptoms"
Diabetic Kidney Disease,Ramipril, Losartan, Dapagliflozin,"Swelling, Fatigue, Poor appetite, Nausea, High blood pressure, Protein in urine"
Nose Disorder,Fluticasone, Budesonide, Oxymetazoline,"Nasal congestion, Discharge, Reduced smell, Nose bleeding, Facial pain, Sneezing"
Drug Withdrawal,Methadone, Buprenorphine, Naloxone,"Anxiety, Sweating, Tremors, Nausea, Insomnia, Seizures"
Dental Caries,Fluoride, Silver Diamine Fluoride,,"Toothache, Tooth sensitivity, Visible holes, Staining, Pain when eating, Bad breath"
Hypercholesterolemia,Atorvastatin, Rosuvastatin, Ezetimibe,"Usually asymptomatic, Xanthomas, Chest pain, Xanthelasma, Fatty deposits"
Fracture of the Patella,Ibuprofen, Naproxen, Acetaminophen,"Knee pain, Swelling, Inability to straighten knee, Bruising, Tenderness"
Kidney Failure,Erythropoietin, Calcitriol, Sevelamer,"Decreased urination, Swelling, Shortness of breath, Fatigue, Nausea, Confusion"
Fracture of the Neck,Ibuprofen, Morphine, Calcium Carbonate,"Severe neck pain, Stiffness, Neurological symptoms, Inability to move neck, Tenderness"
Muscle Spasm,Cyclobenzaprine, Baclofen, Methocarbamol,"Sudden muscle contraction, Pain, Hardness, Involuntary movement, Tenderness"
Hemophilia,Factor VIII Concentrate, Factor IX Concentrate, Desmopressin (DDAVP),"Excessive bleeding, Prolonged bleeding from cuts, Joint pain, Bruising, Blood in urine"
Hyperosmotic Hyperketotic State,Insulin Regular, Normal Saline, Potassium Chloride,"Extreme thirst, Frequent urination, Weakness, Confusion, Nausea, High blood sugar"
Peritonsillar Abscess,Penicillin G, Clindamycin, Metronidazole,"Severe sore throat, Difficulty swallowing, Muffled voice, Fever, Drooling, Neck pain"
Gastroparesis,Metoclopramide, Domperidone, Erythromycin,"Nausea, Vomiting, Feeling full quickly, Bloating, Abdominal pain, Weight loss"
Itching of Unknown Cause,Cetirizine, Hydroxyzine, Diphenhydramine,"Generalized itching, Skin irritation, Redness, Dry skin, Scratching marks"
Polycythemia Vera,Hydroxyurea, Aspirin, Ruxolitinib,"Headache, Dizziness, Itching after bathing, Fatigue, Blurred vision, Redness of skin"
Thrombocytopenia,Prednisone, Eltrombopag, Romiplostim,"Easy bruising, Prolonged bleeding, Petechiae, Rash, Heavy menstruation, Bleeding gums"
Head and Neck Cancer,Cisplatin, Carboplatin, 5-Fluorouracil,"Lump in neck, Difficulty swallowing, Hoarseness, Ear pain, Weight loss, Sore throat"
Pseudohypoparathyroidism,Calcium Carbonate, Calcitriol, Cholecalciferol,"Low calcium, Short stature, Round face, Intellectual disability, Obesity, Muscle cramps"
Goiter,Levothyroxine, Methimazole, Potassium Iodide,"Swollen neck, Difficulty swallowing, Coughing, Hoarseness, Tight feeling in throat"
Urge Incontinence,Oxybutynin, Solifenacin, Tolterodine,"Sudden urge to urinate, Leaking urine, Frequent urination, Nocturia"
Edward Syndrome (Trisomy 18),No specific drug; supportive medications,,,"Heart defects, Clenched fists, Low birth weight, Feeding difficulties, Intellectual disability"
Open Wound of the Arm,Amoxicillin-Clavulanate, Cephalexin, Tetanus Toxoid,"Pain, Bleeding, Swelling, Bruising, Limited movement, Tissue damage"
Muscular Dystrophy,Prednisone, Deflazacort, Eteplirsen,"Progressive muscle weakness, Difficulty walking, Falling, Muscle cramps, Scoliosis"
Mittelschmerz,Ibuprofen, Naproxen, Acetaminophen,"Mid-cycle pelvic pain, Lower abdominal pain, Light spotting, Nausea, Brief pain"
Corneal Abrasion,Moxifloxacin, Tobramycin, Artificial Tears,"Eye pain, Tearing, Redness, Light sensitivity, Foreign body sensation, Blurred vision"
Anemia of Chronic Disease,Epoetin Alfa, Ferric Carboxymaltose, Darbepoetin Alfa,"Fatigue, Weakness, Pale skin, Shortness of breath, Dizziness, Cold extremities"
Dysthymic Disorder,Sertraline, Fluoxetine, Escitalopram,"Persistent low mood, Hopelessness, Fatigue, Poor concentration, Low self-esteem, Sleep problems"
Scarlet Fever,Penicillin V, Amoxicillin, Azithromycin,"High fever, Sore throat, Red rash, Strawberry tongue, Flushed face, Peeling skin"
Hypertensive Heart Disease,Amlodipine, Enalapril, Furosemide,"Chest pain, Shortness of breath, Fatigue, Palpitations, Headache, Dizziness"
Drug Abuse (Barbiturates),Phenobarbital (taper), Diazepam, Clonidine,"Drowsiness, Confusion, Slurred speech, Coordination problems, Mood changes, Respiratory depression"
Polycystic Ovarian Syndrome (PCOS),Metformin, Ethinylestradiol, Cyproterone Acetate,"Irregular periods, Excess hair growth, Acne, Weight gain, Thinning hair, Infertility"
Encephalitis,Acyclovir, Ganciclovir, Dexamethasone,"Fever, Headache, Confusion, Seizures, Stiff neck, Sensitivity to light"
Cyst of the Eyelid,Triamcinolone injection; surgical excision,,,"Swollen eyelid, Painless lump, Redness, Tenderness, Blurred vision if large"
Balanitis,Clotrimazole, Miconazole, Fluconazole,"Redness, Swelling, Discharge, Itching, Pain, Foul smell"
Foreign Body in the Throat,No drug; mechanical removal,,,"Choking, Difficulty swallowing, Gagging, Coughing, Throat pain, Drooling"
Drug Abuse (Cocaine),No antidote; Lorazepam, Propranolol (for symptoms),,"Euphoria, Increased energy, Paranoia, Rapid heartbeat, Nosebleeds, Weight loss"
Optic Neuritis,Methylprednisolone, Interferon Beta-1a,,"Eye pain, Vision loss, Color vision changes, Flashing lights, Blurred vision"
Alcohol Withdrawal,Diazepam, Lorazepam, Chlordiazepoxide,"Tremors, Sweating, Anxiety, Nausea, Insomnia, Seizures"
Premature Atrial Contractions (PACs),Metoprolol, Atenolol, Verapamil,"Palpitations, Fluttering, Skipped beats, Dizziness, Chest discomfort"
Hemiplegia,Aspirin, Clopidogrel, Alteplase,"One-sided paralysis, Muscle weakness, Spasticity, Difficulty walking, Speech problems"
Hammer Toe,Ibuprofen, Naproxen; surgical correction,,"Toe deformity, Pain, Corns, Calluses, Difficulty wearing shoes, Swelling"
Open Wound of the Cheek,Amoxicillin-Clavulanate, Cephalexin, Tetanus Toxoid,"Pain, Bleeding, Swelling, Bruising, Tissue damage, Scarring"
Joint Effusion,Triamcinolone, Methylprednisolone, Ibuprofen,"Joint swelling, Pain, Stiffness, Warmth, Limited movement"
Open Wound of the Knee,Amoxicillin-Clavulanate, Cephalexin, Tetanus Toxoid,"Pain, Bleeding, Swelling, Limited movement, Bruising"
Meningioma,Dexamethasone, Mifepristone; surgical resection,,"Headaches, Seizures, Vision changes, Weakness, Hearing loss, Memory problems"
Brain Cancer,Temozolomide, Bevacizumab, Carmustine,"Headaches, Seizures, Vision changes, Personality changes, Cognitive decline, Nausea"
Placental Abruption,Oxytocin, Magnesium Sulfate, Betamethasone,"Sudden abdominal pain, Vaginal bleeding, Uterine rigidity, Back pain, Fetal distress"
Seasonal Allergies (Hay Fever),Cetirizine, Loratadine, Fexofenadine,"Sneezing, Runny nose, Itchy eyes, Congestion, Postnasal drip, Fatigue"
Lung Cancer,Cisplatin, Carboplatin, Paclitaxel,"Persistent cough, Coughing blood, Shortness of breath, Chest pain, Hoarseness, Weight loss"
Primary Kidney Disease,Ramipril, Losartan, Furosemide,"Swelling, Fatigue, Blood in urine, Foamy urine, High blood pressure, Reduced urination"
Uterine Cancer,Carboplatin, Paclitaxel, Medroxyprogesterone,"Abnormal vaginal bleeding, Pelvic pain, Watery discharge, Painful urination, Weight loss"
Dry Eye of Unknown Cause,Cyclosporine (Restasis), Lifitegrast, Artificial Tears,"Burning, Stinging, Redness, Blurred vision, Sensitivity to light, Eye fatigue"
Fibrocystic Breast Disease,Ibuprofen, Danazol, Bromocriptine,"Breast lumps, Breast pain, Tenderness, Nipple discharge, Swelling before period"
Fungal Infection of the Hair,Griseofulvin, Terbinafine, Itraconazole,"Scaly patches, Hair loss, Itching, Redness, Brittle hair, Bald spots"
Tooth Abscess,Amoxicillin, Metronidazole, Clindamycin,"Severe toothache, Swelling, Fever, Bitter taste, Swollen lymph nodes, Sensitivity"
Envenomation from Spider or Animal Bite,Antivenom, Methylprednisolone, Tetanus Toxoid,"Pain at bite site, Swelling, Redness, Nausea, Muscle cramps, Fever"
VACTERL Syndrome,No specific drug; supportive medications for each defect,,,"Vertebral defects, Cardiac defects, Tracheoesophageal fistula, Renal anomalies, Limb defects"
Vertebrobasilar Insufficiency,Aspirin, Clopidogrel, Atorvastatin,"Dizziness, Double vision, Slurred speech, Difficulty swallowing, Coordination problems"
Rectal Disorder,Hydrocortisone, Mesalazine, Metronidazole,"Rectal pain, Bleeding, Discharge, Itching, Constipation, Diarrhea"
Atonic Bladder,Bethanechol, Neostigmine,,"Difficulty urinating, Weak stream, Frequent UTIs, Overflow incontinence, Bladder fullness"
Benign Paroxysmal Positional Vertigo (BPPV),Meclizine, Dimenhydrinate; Epley maneuver,,"Brief vertigo episodes, Dizziness with head movement, Nausea, Nystagmus, Imbalance"
Blepharospasm,Botulinum Toxin Type A, Clonazepam, Trihexyphenidyl,"Involuntary eyelid blinking, Eye irritation, Sensitivity to light, Difficulty opening eyes"
Sarcoidosis,Prednisone, Hydroxychloroquine, Methotrexate,"Fatigue, Shortness of breath, Cough, Skin lesions, Swollen lymph nodes, Fever"
Metastatic Cancer,Depends on primary; Pembrolizumab, Nivolumab, Cisplatin,"Pain at metastasis site, Fatigue, Weight loss, Loss of appetite, Organ dysfunction"
Trigger Finger,Triamcinolone, Methylprednisolone; surgical release,,"Finger stiffness, Clicking, Locking, Pain at base of finger, Swelling"
Stye (Hordeolum),Erythromycin ointment, Bacitracin, Tobramycin drops,"Painful eyelid lump, Redness, Swelling, Tearing, Light sensitivity, Discharge"
Hemochromatosis,Deferoxamine, Deferasirox, Deferiprone,"Fatigue, Joint pain, Abdominal pain, Skin bronzing, Diabetes, Liver disease"
Osteochondroma,Ibuprofen, Naproxen; surgical excision,,"Bone lump, Pain, Limited joint movement, Numbness, Weakness if nerve compressed"
Cushing Syndrome,Ketoconazole, Metyrapone, Mifepristone,"Weight gain, Moon face, Buffalo hump, Stretch marks, Easy bruising, High blood pressure"
Typhoid Fever,Ciprofloxacin, Ceftriaxone, Azithromycin,"High fever, Headache, Abdominal pain, Constipation or diarrhea, Rose spots, Weakness"
Vitreous Degeneration,No drug; vitrectomy if severe,,,"Floaters, Flashes of light, Blurred vision, Shadow in vision"
Atrophic Skin Condition,Tretinoin, Retinol, Urea,"Thin skin, Fragility, Wrinkles, Dryness, Bruising, Skin tears"
Aspergillosis,Voriconazole, Isavuconazole, Amphotericin B,"Cough, Shortness of breath, Fever, Chest pain, Coughing blood, Wheezing"
Uterine Atony,Oxytocin, Misoprostol, Ergometrine,"Heavy postpartum bleeding, Soft uterus, Abdominal pain, Signs of hemorrhage"
Trichinosis,Albendazole, Mebendazole, Prednisone,"Diarrhea, Abdominal pain, Muscle pain, Fever, Swollen eyes, Fatigue"
Whooping Cough (Pertussis),Azithromycin, Clarithromycin, Erythromycin,"Severe coughing fits, Whooping sound, Vomiting after coughing, Runny nose, Mild fever"
Open Wound of the Lip,Amoxicillin-Clavulanate, Cephalexin, Tetanus Toxoid,"Pain, Bleeding, Swelling, Bruising"
Subacute Thyroiditis,Ibuprofen, Naproxen, Prednisone,"Neck pain, Thyroid tenderness, Fever, Fatigue, Temporary hyperthyroidism then hypothyroidism"
Oral Mucosal Lesion,Triamcinolone Acetonide, Lidocaine, Chlorhexidine,"Mouth sores, Pain, White or red patches, Bleeding, Difficulty eating"
Open Wound due to Trauma,Amoxicillin-Clavulanate, Cephalexin, Tetanus Toxoid,"Pain, Bleeding, Swelling, Bruising, Tissue damage"
Intracerebral Hemorrhage,Labetalol, Nicardipine, Vitamin K,"Sudden severe headache, Weakness, Numbness, Speech problems, Vision changes, Confusion"
Alzheimer Disease,Donepezil, Rivastigmine, Galantamine,"Memory loss, Confusion, Difficulty with language, Disorientation, Personality changes, Poor judgment"
Vaginismus,Botulinum Toxin Type A, Diazepam (vaginal), Lidocaine gel,"Painful intercourse, Involuntary vaginal muscle spasms, Difficulty with penetration, Anxiety"
Systemic Lupus Erythematosus (SLE),Hydroxychloroquine, Prednisone, Azathioprine,"Butterfly rash, Joint pain, Fatigue, Fever, Kidney problems, Hair loss"
Premature Ovarian Failure,Estradiol, Progesterone, Calcium Carbonate,"Irregular periods, Hot flashes, Night sweats, Infertility, Vaginal dryness, Mood changes"
Thoracic Outlet Syndrome,Ibuprofen, Naproxen, Gabapentin; surgical decompression,"Arm pain, Numbness, Tingling, Weakness, Neck pain, Shoulder pain"
Ganglion Cyst,Triamcinolone; aspiration or surgical excision,,,"Visible lump, Pain, Tingling, Muscle weakness, Limited joint movement"
Dislocation of the Knee,Ibuprofen, Morphine; surgical ligament repair,,"Severe knee pain, Deformity, Swelling, Inability to move, Neurovascular compromise"
Crohn Disease,Mesalazine, Prednisone, Azathioprine,"Abdominal pain, Diarrhea, Weight loss, Fatigue, Fever, Rectal bleeding"
Postoperative Infection,Amoxicillin-Clavulanate, Vancomycin, Piperacillin-Tazobactam,"Wound redness, Swelling, Discharge, Fever, Pain, Warmth"
Folate Deficiency,Folic Acid,,,"Fatigue, Weakness, Mouth sores, Gray hair, Swollen tongue, Anemia symptoms"
Fluid Overload,Furosemide, Bumetanide, Spironolactone,"Swelling, Shortness of breath, Weight gain, High blood pressure, Crackles in lungs"
Atrial Flutter,Metoprolol, Diltiazem, Verapamil,"Palpitations, Rapid heartbeat, Dizziness, Shortness of breath, Chest pain, Fatigue"
Skin Disorder,Treat cause; Hydrocortisone, Betamethasone, Tacrolimus,"Rash, Itching, Redness, Swelling, Blisters, Scaling"
Floaters,No drug; vitrectomy if severe,,,"Spots in vision, Strings, Cobwebs, Moving shadows"
Tooth Disorder,Amoxicillin, Ibuprofen, Fluoride,"Toothache, Sensitivity, Swelling, Bad breath, Loose teeth"
Heart Attack (MI),Aspirin, Clopidogrel, Atenolol,"Chest pain, Arm pain, Shortness of breath, Sweating, Nausea, Jaw pain"
Open Wound of the Abdomen,Amoxicillin-Clavulanate, Metronidazole, Morphine,"Pain, Bleeding, Swelling, Tissue damage, Shock if severe"
Fracture of the Leg,Ibuprofen, Acetaminophen, Morphine,"Leg pain, Swelling, Deformity, Inability to bear weight, Bruising, Tenderness"
Oral Thrush (Yeast Infection),Nystatin, Fluconazole, Clotrimazole,"White patches in mouth, Soreness, Difficulty swallowing, Loss of taste, Redness"
Pityriasis Rosea,Cetirizine, Hydrocortisone, Acyclovir (severe cases),"Pink oval rash, Herald patch, Itching, Mild fever, Fatigue, Scaling"
Allergy to Animals,Cetirizine, Loratadine, Fexofenadine,"Sneezing, Runny nose, Itchy eyes, Skin rash, Asthma symptoms, Congestion"
Orthostatic Hypotension,Fludrocortisone, Midodrine, Droxidopa,"Dizziness when standing, Lightheadedness, Fainting, Blurred vision, Weakness"
Obstructive Sleep Apnea (OSA),No drug; CPAP; Modafinil for residual sleepiness,,,"Loud snoring, Gasping during sleep, Morning headache, Daytime sleepiness, Insomnia"
Hypokalemia,Potassium Chloride, Spironolactone, Amiloride,"Muscle weakness, Cramps, Constipation, Palpitations, Fatigue, Numbness"
Psoriasis,Betamethasone, Calcipotriol, Methotrexate,"Red scaly patches, Itching, Dry cracked skin, Nail changes, Joint pain, Burning"
Dislocation of the Shoulder,Ibuprofen, Diazepam, Morphine; reduction procedure,"Shoulder pain, Deformity, Swelling, Numbness, Muscle spasms, Limited movement"
Intussusception,No drug; enema reduction or surgical correction,,,"Sudden severe abdominal pain, Vomiting, Bloody stool, Lump in abdomen, Lethargy"
Cervicitis,Azithromycin, Ceftriaxone, Doxycycline,"Vaginal discharge, Bleeding between periods, Pain during intercourse, Pelvic pain"
Abscess of the Pharynx,Penicillin G, Clindamycin, Metronidazole,"Severe sore throat, Difficulty swallowing, Fever, Neck pain, Drooling, Muffled voice"
Primary Thrombocythemia,Aspirin, Hydroxyurea, Anagrelide,"Headache, Dizziness, Chest pain, Redness of hands, Blood clots, Bleeding"
Arthritis of the Hip,Ibuprofen, Naproxen, Celecoxib,"Hip pain, Stiffness, Reduced range of motion, Limping, Groin pain, Difficulty walking"
Decubitus Ulcer,Hydrocolloid dressings, Silver Sulfadiazine, Collagenase,"Skin redness, Open sore, Tissue breakdown, Pain, Infection, Odor"
Hypernatremia,Dextrose 5% in Water (D5W), Normal Saline 0.45%,,"Extreme thirst, Confusion, Agitation, Muscle twitching, Seizures, Coma if severe"
Sensorineural Hearing Loss,Prednisone, Methylprednisolone (sudden onset),,"Hearing loss, Difficulty with speech, Tinnitus, Balance problems, Difficulty hearing in noise"
Chronic Ulcer,Silver Sulfadiazine, Bacitracin, Collagenase,"Persistent sore, Pain, Bleeding, Infection, Slow healing, Discharge"
Osteoporosis,Alendronate, Risedronate, Denosumab,"Back pain, Height loss, Stooped posture, Easy fractures, Bone fragility"
Ileus,Neostigmine (paralytic ileus), Metoclopramide,,"Abdominal distension, No bowel sounds, Nausea, Vomiting, Constipation, Abdominal pain"
Sickle Cell Crisis,Morphine, Hydroxyurea, Oxygen,"Severe pain, Swelling, Fever, Fatigue, Shortness of breath, Jaundice"
Urethritis,Azithromycin, Ceftriaxone, Doxycycline,"Painful urination, Discharge, Frequency, Urgency, Itching, Burning"
Prostatitis,Ciprofloxacin, Levofloxacin, Tamsulosin,"Pelvic pain, Painful urination, Frequency, Urgency, Fever, Painful ejaculation"
Otitis Externa (Swimmer's Ear),Ciprofloxacin + Hydrocortisone ear drops, Acetic Acid,,"Ear pain, Itching, Discharge, Hearing loss, Swelling, Redness"
Poisoning due to Anticonvulsants,Activated Charcoal, Naloxone, Flumazenil,"Drowsiness, Dizziness, Ataxia, Nausea, Blurred vision, Confusion"
Testicular Torsion,No drug; emergency surgery,,,"Sudden severe testicular pain, Swelling, Nausea, Vomiting, Abdominal pain"
Tricuspid Valve Disease,Furosemide, Spironolactone; surgical repair,,"Fatigue, Swelling, Palpitations, Shortness of breath, Abdominal discomfort, Jaundice"
